{
  "schema_version": "laetex.tokenizer.manifest/v1",
  "snapshot_id": "synthetic-local-contract-test-v1",
  "created_at": "2026-07-13T00:00:00Z",
  "training_allowed": true,
  "purpose": "synthetic_test",
  "sources": [
    {
      "source_id": "synthetic-local-test",
      "uri": "generated://laetex-tokenizer/synthetic-v1",
      "source_type": "synthetic",
      "synthetic": true,
      "license": {
        "status": "approved",
        "spdx_id": "Apache-2.0",
        "evidence_uri": "generated://laetex-tokenizer/package-license",
        "reviewed_by": "synthetic-fixture-policy"
      },
      "pii": {
        "status": "clear",
        "scanner": "fixture-construction-review/v1",
        "evidence_uri": "generated://laetex-tokenizer/pii-review"
      },
      "secrets": {
        "status": "clear",
        "scanner": "fixture-construction-review/v1",
        "evidence_uri": "generated://laetex-tokenizer/secrets-review"
      },
      "dedup": {
        "status": "complete",
        "exact": "sha256",
        "near_duplicate": "not-applicable-synthetic-fixture",
        "tool_version": "laetex-tokenizer/0.1.0"
      },
      "content_hash": {
        "algorithm": "sha256",
        "value": "0000000000000000000000000000000000000000000000000000000000000000"
      }
    }
  ],
  "normalization": {
    "unicode": "identity",
    "line_endings": "preserve",
    "encoding": "utf-8-strict"
  },
  "tokenizer": {
    "type": "byte_level_bpe",
    "vocab_size": 128000,
    "byte_fallback": true,
    "special_tokens": [
      "<|bos|>",
      "<|eos|>",
      "<|pad|>",
      "<|system|>",
      "<|user|>",
      "<|assistant|>",
      "<|tool|>",
      "<|tool_result|>",
      "<|state|>",
      "<|action|>",
      "<|evidence|>",
      "<|policy|>",
      "<|repo|>",
      "<|file|>",
      "<|diff|>"
    ]
  }
}
